Ad_Group,Key_Messaging,CTA,Headlines,Descriptions
Sleep Problems,"Sleep quality, no grogginess, natural solution",Shop Now,"Fall Asleep Faster - No Grogginess | Natural Sleep Aid That Works | Finally, Deep Restful Sleep | Sleep Through The Night | Wake Up Refreshed Daily | Clinically-Backed Sleep Support | End Sleepless Nights Today | Time-Release Sleep Formula",Magnesium L-Threonate helps you fall asleep naturally without morning grogginess. 30-day money-back guarantee. | Clinically studied magnesium formula supports deeper sleep cycles. Try risk-free for 30 nights. | Say goodbye to tossing and turning. Our time-release formula works while you sleep.
Melatonin Alternatives,"Melatonin-free, no hormones, no tolerance, no grogginess",Try It Risk-Free,Melatonin-Free Sleep Aid | Ditch The Melatonin Grogginess | Sleep Better Without Hormones | Natural Alternative To Melatonin | No More Morning Fog | Sleep Aid Without Side Effects | Non-Habit Forming Sleep Support | Break Up With Melatonin,"Magnesium L-Threonate supports sleep naturally without hormones or next-day grogginess. | The melatonin alternative that actually works. Clinically-backed, non-habit forming formula. | Tired of melatonin tolerance? Try the science-backed sleep mineral that supports your body naturally."
Magnesium for Sleep,"Superior absorption, crosses blood-brain barrier, premium quality",Learn More,Best Magnesium For Sleep | Magnesium L-Threonate Works | Most Absorbable Magnesium | Premium Magnesium Sleep Aid | Brain-Ready Magnesium Formula | Not All Magnesium Is Equal | The Sleep Magnesium Experts Use | Time-Release Magnesium Sleep,"Magnesium L-Threonate crosses the blood-brain barrier for superior sleep and cognitive support. | The only magnesium proven to effectively reach the brain. Better absorption = better sleep. | Unlike glycinate or citrate, L-Threonate is designed for brain health and quality sleep."
Cognitive Enhancement,"Brain fog relief, mental clarity, cognitive support, dual benefit",Boost Your Brain,"Clear Brain Fog Naturally | Sharpen Your Mental Clarity | Focus Better, Think Clearer | Brain Fog Relief That Works | Support Cognitive Function | Mental Energy Without Crash | Brain Health While You Sleep | Wake Up Mentally Sharp","Magnesium L-Threonate supports brain health and cognitive function while promoting restful sleep. | The dual-action formula for better sleep AND clearer thinking. Clinically studied ingredients. | Support memory, focus, and mental clarity with the magnesium that actually reaches your brain."
Stress & Anxiety,"Stress relief, cortisol support, natural calm, evening wind-down",Find Your Calm,"Calm Your Mind Naturally | Evening Stress Relief | Wind Down After Work | Support Healthy Cortisol | Relax Without Drowsiness | Stress Relief For Sleep | Calm Days, Restful Nights | Natural Calm Supplement","Magnesium L-Threonate helps your body manage stress and supports healthy cortisol levels. | The natural way to unwind and prepare for restorative sleep. Non-drowsy formula. | Support your stress response while improving sleep quality. Two benefits, one supplement."
Brand & Competitor,"Premium positioning, comparison, superior quality, upgrade",Compare Now,Better Than Magnesium Glycinate | Premium Magnesium L-Threonate | Why Settle For Less? | The Gold Standard Magnesium | Upgrade Your Magnesium | Clinically Proven Formula | Not Your Average Magnesium | The Brain Magnesium Choice,"See why Magnesium L-Threonate outperforms glycinate and citrate for sleep and brain health. | Compare the science. L-Threonate is the only magnesium proven to cross the blood-brain barrier. | Premium quality, maximum absorption, proven results. The magnesium upgrade you deserve."
